<?xml version="1.0" encoding="UTF-8"?>

<iFAB:hudatWelds xmlns:xsi="http://www.w3.org/2001/XMLSchema-instance" xmlns:iFAB="iFAB" xsi:schemaLocation="iFAB hudat.xsd">
	<hudatWeld>
		<name>Weld_AB</name>
		<componentClass>HuDATWeld</componentClass>
		<UUID>Weld_AB_1234</UUID>
    		<instanceID>Weld_AB_1234.1</instanceID>
		<jointType>corner</jointType>
		<grooveConfiguration>custom</grooveConfiguration>
		<weldJointConfiguration>ballistic fillet fillet</weldJointConfiguration>
		<weldPenetration>full</weldPenetration>
		<doubleSided>true</doubleSided>
		<materialWeldCompatible>true</materialWeldCompatible>
		<weldProcess>GMAW</weldProcess>
		<inspectionReqt>Visual</inspectionReqt>
		<weldLength unit="mm">6883.6</weldLength>
		<jointStrengthReqt unit="Mpa" >938</jointStrengthReqt>
		<jointElongationReqt>12</jointElongationReqt>
		<fillerMaterialSpec>ERS100S</fillerMaterialSpec>
		<weldSide1>
			<incAngle unit = "degrees">90</incAngle>
			<leg1Length unit="mm">22.225</leg1Length>
			<leg2Length unit="mm">22.22</leg2Length>
			<weldArea unit="mm2">246.9</weldArea>
			<weldVolume unit="mm3">1700076</weldVolume>
		</weldSide1>
		<weldSide2>
			<incAngle unit = "degrees">90</incAngle>
			<leg1Length unit="mm">22.225</leg1Length>
			<leg2Length unit="mm">22.225</leg2Length>
			<weldArea unit="mm2">246.9</weldArea>
			<weldVolume unit="mm3">1700076</weldVolume>
		</weldSide2>
		<part1>
			<id>140_PANEL_A_DET</id>
			<stockNumber>stockNumber</stockNumber>
			<thickness unit="mm">25.40</thickness>
			<material id="Steel MIL-DTL-12560">material</material>
		</part1>
		<part2>
			<id>140_PANEL_B_DET</id>
			<stockNumber>stockNumber</stockNumber>
			<thickness unit="mm">25.40</thickness>
			<material id="Steel MIL-DTL-12560">material</material>
		</part2>
	</hudatWeld>
	<hudatWeld>
		<name>Weld_AH</name>
  		<componentClass>HuDATWeld</componentClass>
  		<UUID>Weld_AH_1234</UUID>
  		<instanceID>Weld_AH_1234.1</instanceID>
  		<jointType>corner</jointType>
  		<grooveConfiguration>custom</grooveConfiguration>
  		<weldJointConfiguration>ballistic fillet fillet</weldJointConfiguration>
  		<weldPenetration>full</weldPenetration>
  		<doubleSided>true</doubleSided>
  		<materialWeldCompatible>true</materialWeldCompatible>
  		<weldProcess>GMAW</weldProcess>
  		<inspectionReqt>X-Ray</inspectionReqt>
  		<weldLength unit="mm">6883.6</weldLength>
  		<jointStrengthReqt unit="Mpa">938</jointStrengthReqt>
  		<jointElongationReqt>12</jointElongationReqt>
  		<fillerMaterialSpec>ERS100S</fillerMaterialSpec>
  		<weldSide1>
    			<incAngle>90</incAngle>
    			<leg1Length unit="mm">22.225</leg1Length>
    			<leg2Length unit="mm">22.22</leg2Length>
    			<weldArea unit="mm2">246.9</weldArea>
    			<weldVolume unit="mm3">1700076</weldVolume>
  		</weldSide1>
  		<weldSide2>
    			<incAngle unit="degrees">90</incAngle>
    			<leg1Length unit="mm">22.225</leg1Length>
    			<leg2Length unit="mm">22.225</leg2Length>
    			<weldArea unit="mm2">246.9</weldArea>
    			<weldVolume unit="mm3">1700076</weldVolume>
  		</weldSide2>
  		<part1>
    			<id>140_PANEL_A_DET</id>
    			<stockNumber>stockNumber</stockNumber>
    			<thickness unit="mm">25.40</thickness>
    			<material id="Steel MIL-DTL-12560">material</material>
  		</part1>
  		<part2>
    			<id>140_PANEL_H_DET</id>
    			<stockNumber>stockNumber</stockNumber>
    			<thickness unit="mm">25.40</thickness>
    			<material id="Steel MIL-DTL-12560">material</material>
  		</part2>
	</hudatWeld>
	<hudatWeld>
		<name>Weld_AL</name>
		<componentClass>HuDATWeld</componentClass>
  		<UUID>Weld_AL_1234</UUID>
  		<instanceID>Weld_AL_1234.1</instanceID>
  		<jointType>skewedplate</jointType>
  		<grooveConfiguration>custom</grooveConfiguration>
  		<weldJointConfiguration>ballistic fillet fillet</weldJointConfiguration>
  		<weldPenetration>full</weldPenetration>
  		<doubleSided>true</doubleSided>
  		<materialWeldCompatible>true</materialWeldCompatible>
  		<weldProcess>GMAW</weldProcess>
  		<inspectionReqt>X-Ray</inspectionReqt>
  		<weldLength unit="mm">3660</weldLength>
  		<jointStrengthReqt unit="Mpa">938</jointStrengthReqt>
  		<jointElongationReqt>12</jointElongationReqt>
  		<fillerMaterialSpec>ERS100S</fillerMaterialSpec>
  		<weldSide1>
    			<incAngle>90</incAngle>
    			<leg1Length unit="mm">22.23</leg1Length>
    			<leg2Length unit="mm">22.23</leg2Length>
    			<weldArea unit="mm2">247.0</weldArea>
    			<weldVolume unit="mm3">904336</weldVolume>
  		</weldSide1>
  		<weldSide2>
    			<incAngle unit="degrees">90</incAngle>
    			<leg1Length unit="mm">22.23</leg1Length>
    			<leg2Length unit="mm">22.23</leg2Length>
    			<weldArea unit="mm2">247.0</weldArea>
    			<weldVolume unit="mm3">904336</weldVolume>
  		</weldSide2>
  		<part1>
    			<id>140_PANEL_A_DET</id>
    			<stockNumber>stockNumber</stockNumber>
    			<thickness unit="mm">25.40</thickness>
    			<material id="Steel MIL-DTL-12560">material</material>
  		</part1>
  		<part2>
    			<id>140_PANEL_L_DET</id>
    			<stockNumber>stockNumber</stockNumber>
    			<thickness unit="mm">25.40</thickness>
    			<material id="Steel MIL-DTL-12560">material</material>
  		</part2>
	</hudatWeld>
	<hudatWeld>
	  	<name>Weld_CB</name>
  		<componentClass>HuDATWeld</componentClass>
  		<UUID>Weld_CB_1234</UUID>
  		<instanceID>Weld_CB_1234.1</instanceID>
  		<jointType>corner</jointType>
  		<grooveConfiguration>custom</grooveConfiguration>
  		<weldJointConfiguration>ballistic fillet fillet</weldJointConfiguration>
  		<weldPenetration>full</weldPenetration>
  		<doubleSided>true</doubleSided>
  		<materialWeldCompatible>true</materialWeldCompatible>
  		<weldProcess>GMAW</weldProcess>
  		<inspectionReqt>Visual</inspectionReqt>
  		<weldLength unit="mm">7482</weldLength>
  		<jointStrengthReqt unit="Mpa">938</jointStrengthReqt>
  		<jointElongationReqt>12</jointElongationReqt>
  		<fillerMaterialSpec>ERS100S</fillerMaterialSpec>
  		<weldSide1>
    			<incAngle unit="degrees">90</incAngle>
    			<leg1Length unit="mm">22.225</leg1Length>
    			<leg2Length unit="mm">22.22</leg2Length>
    			<weldArea unit="mm2">246.9</weldArea>
    			<weldVolume unit="mm3">1848064</weldVolume>
  		</weldSide1>
  		<weldSide2>
    			<incAngle unit="degrees">90</incAngle>
    			<leg1Length unit="mm">22.225</leg1Length>
    			<leg2Length unit="mm">22.225</leg2Length>
    			<weldArea unit="mm2">246.9</weldArea>
    			<weldVolume unit="mm3">1848064</weldVolume>
  		</weldSide2>
  		<part1>
    			<id>140_PANEL_C_DET</id>
    			<stockNumber>stockNumber</stockNumber>
    			<thickness unit="mm">25.40</thickness>
    			<material id="Steel MIL-DTL-12560">material</material>
  		</part1>
  		<part2>
    			<id>140_PANEL_B_DET</id>
    			<stockNumber>stockNumber</stockNumber>
    			<thickness unit="mm">25.40</thickness>
    			<material id="Steel MIL-DTL-12560">material</material>
  		</part2>
	</hudatWeld>
	<hudatWeld>
  		<name>Weld_DC</name>
  		<componentClass>HuDATWeld</componentClass>
  		<UUID>Weld_DC_1234</UUID>
  		<instanceID>Weld_DC_1234.1</instanceID>
  		<jointType>corner</jointType>
  		<grooveConfiguration>custom</grooveConfiguration>
  		<weldJointConfiguration>ballistic fillet fillet</weldJointConfiguration>
  		<weldPenetration>full</weldPenetration>
  		<doubleSided>true</doubleSided>
  		<materialWeldCompatible>true</materialWeldCompatible>
  		<weldProcess>GMAW</weldProcess>
  		<inspectionReqt>Visual</inspectionReqt>
  		<weldLength  unit="mm">7482</weldLength>
  		<jointStrengthReqt  unit="Mpa">938</jointStrengthReqt>
  		<jointElongationReqt>12</jointElongationReqt>
  		<fillerMaterialSpec>ERS100S</fillerMaterialSpec>
  		<weldSide1>
    			<incAngle unit="degrees">90</incAngle>
    			<leg1Length unit="mm">22.225</leg1Length>
    			<leg2Length  unit="mm">22.22</leg2Length>
    			<weldArea  unit="mm2">246.9</weldArea>
    			<weldVolume  unit="mm3">1848064</weldVolume>
  		</weldSide1>
  		<weldSide2>
    			<incAngle  unit="degrees">90</incAngle>
    			<leg1Length unit="mm">22.225</leg1Length>
    			<leg2Length unit="mm">22.225</leg2Length>
    			<weldArea unit="mm2">246.9</weldArea>
    			<weldVolume  unit="mm3">1848064</weldVolume>
  		</weldSide2>
  		<part1>
    			<id>140_PANEL_D_DET</id>
    			<stockNumber>stockNumber</stockNumber>
    			<thickness>25.40</thickness>
    			<material id="Steel MIL-DTL-12560">material</material>
  		</part1>
  		<part2>
    			<id>140_PANEL_C_DET</id>
    			<stockNumber>stockNumber</stockNumber>
    			<thickness>25.40</thickness>
    			<material id="Steel MIL-DTL-12560">material</material>
  		</part2>
	</hudatWeld>
	<hudatWeld>
  		<name>Weld_ED</name>
  		<componentClass>HuDATWeld</componentClass>
  		<UUID>Weld_ED_1234</UUID>
  		<instanceID>Weld_ED_1234.1</instanceID>
  		<jointType>corner</jointType>
  		<grooveConfiguration>custom</grooveConfiguration>
  		<weldJointConfiguration>ballistic fillet fillet</weldJointConfiguration>
  		<weldPenetration>full</weldPenetration>
  		<doubleSided>true</doubleSided>
  		<materialWeldCompatible>true</materialWeldCompatible>
  		<weldProcess>GMAW</weldProcess>
  		<inspectionReqt>Visual</inspectionReqt>
  		<weldLength  unit="mm">6843.5</weldLength>
  		<jointStrengthReqt  unit="Mpa">938</jointStrengthReqt>
  		<jointElongationReqt>12</jointElongationReqt>
  		<fillerMaterialSpec>ERS100S</fillerMaterialSpec>
  		<weldSide1>
    			<incAngle  unit="degrees">90</incAngle>
    			<leg1Length  unit="mm">22.225</leg1Length>
    			<leg2Length unit="mm">22.22</leg2Length>
    			<weldArea unit="mm2">246.9</weldArea>
    			<weldVolume  unit="mm3">1690175</weldVolume>
  		</weldSide1>
  		<weldSide2>
    			<incAngle  unit="degrees">90</incAngle>